{
  "schema": "certigo.coverage-matrix/v1",
  "provider": "aws",
  "certification": "aws:clf-c02",
  "blueprintVersion": "2026-08-17",
  "status": "planned",
  "objectives": [
    {
      "objective": "domain-1",
      "title": "Cloud Concepts",
      "weightPercent": 24,
      "weightType": "exact",
      "questionIds": [
        "aws.clf-c02.domain-1.cloud-value.001"
      ]
    },
    {
      "objective": "domain-2",
      "title": "Security and Compliance",
      "weightPercent": 30,
      "weightType": "exact",
      "questionIds": []
    },
    {
      "objective": "domain-3",
      "title": "Cloud Technology and Services",
      "weightPercent": 34,
      "weightType": "exact",
      "questionIds": []
    },
    {
      "objective": "domain-4",
      "title": "Billing, Pricing, and Support",
      "weightPercent": 12,
      "weightType": "exact",
      "questionIds": []
    }
  ]
}
