{
  "schema": "certigo.coverage-matrix/v1",
  "provider": "microsoft",
  "certification": "microsoft:dp-600",
  "blueprintVersion": "2026-10-21",
  "status": "in-progress",
  "objectives": [
    {
      "objective": "section-1",
      "title": "Maintain a data analytics solution",
      "weightPercent": 27,
      "weightType": "approximate",
      "questionIds": [
        "microsoft.dp-600.section-1.cycle-vie-git-pipelines-deploiement-gouvernance-fabric.001"
      ]
    },
    {
      "objective": "section-2",
      "title": "Prepare data",
      "weightPercent": 46,
      "weightType": "approximate",
      "questionIds": [
        "microsoft.dp-600.section-2.architecture-medaillon-onelake-shortcuts-optimisation-delta.002"
      ]
    },
    {
      "objective": "section-3",
      "title": "Implement and manage semantic models",
      "weightPercent": 27,
      "weightType": "approximate",
      "questionIds": [
        "microsoft.dp-600.section-3.modele-semantique-direct-lake-etoile-mesures-dax.003",
        "microsoft.dp-600.section-3.securite-ligne-objet-rls-ols-modele-semantique-partage.004"
      ]
    }
  ]
}
