{
  "schema": "certigo.coverage-matrix/v1",
  "provider": "microsoft",
  "certification": "microsoft:gh-300",
  "blueprintVersion": "2026-10-21",
  "status": "in-progress",
  "objectives": [
    {
      "objective": "section-1",
      "title": "Use GitHub Copilot responsibly",
      "weightPercent": 18,
      "weightType": "approximate",
      "questionIds": [
        "microsoft.gh-300.section-1.gouvernance-responsable-filtrage-code-public.001"
      ]
    },
    {
      "objective": "section-2",
      "title": "Use GitHub Copilot features",
      "weightPercent": 28,
      "weightType": "approximate",
      "questionIds": [
        "microsoft.gh-300.section-2.portee-contexte-participants-agents-chat.002"
      ]
    },
    {
      "objective": "section-3",
      "title": "Understand GitHub Copilot data and architecture",
      "weightPercent": 13,
      "weightType": "approximate",
      "questionIds": [
        "microsoft.gh-300.section-3.pipeline-traitement-prompt-proxys-filtrage-architecture.005"
      ]
    },
    {
      "objective": "section-4",
      "title": "Apply prompt engineering and context crafting",
      "weightPercent": 14,
      "weightType": "approximate",
      "questionIds": [
        "microsoft.gh-300.section-4.ingenierie-contexte-instructions-depot.003"
      ]
    },
    {
      "objective": "section-5",
      "title": "Improve developer productivity with GitHub Copilot",
      "weightPercent": 14,
      "weightType": "approximate",
      "questionIds": [
        "microsoft.gh-300.section-5.generation-tests-unitaires-commandes-slash-productivite.006"
      ]
    },
    {
      "objective": "section-6",
      "title": "Configure privacy, content exclusions, and safeguards",
      "weightPercent": 13,
      "weightType": "approximate",
      "questionIds": [
        "microsoft.gh-300.section-6.exclusion-contenu-fichiers-sensibles-entreprise.004"
      ]
    }
  ]
}
